<?xml version="1.0" encoding="ISO-8859-1"?>
<!DOCTYPE Gallery SYSTEM "../dtd/gallery.dtd">
<Gallery>
	<Title>cars</Title>
    <MediaFile id="4564">
        <File mediaType="swf" src="../../media/_special_image_animation.swf" width="1600" height="800" align="left" enableFill="false"/>
        <PreviewFile mediaType="jpg" src="../../media/image_147_thumb.jpg" width="88" height="100"/>
        <Caption/>
    </MediaFile>
    <MediaFile id="147">
        <File mediaType="jpg" src="../../media/image_147.jpg" width="990" height="600" align="right" enableFill="false"/>
        <PreviewFile mediaType="jpg" src="../../media/image_147_thumb.jpg" width="88" height="100"/>
        <Caption/>
    </MediaFile>
    <MediaFile id="148">
        <File mediaType="jpg" src="../../media/image_148.jpg" width="990" height="600" align="right" enableFill="true"/>
        <PreviewFile mediaType="jpg" src="../../media/image_148_thumb.jpg" width="88" height="100"/>
        <Caption/>
    </MediaFile>
    <MediaFile id="149">
        <File mediaType="jpg" src="../../media/image_149.jpg" width="990" height="600" align="left" enableFill="true"/>
        <PreviewFile mediaType="jpg" src="../../media/image_149_thumb.jpg" width="88" height="100"/>
        <Caption/>
    </MediaFile>
    <MediaFile id="153">
        <File mediaType="jpg" src="../../media/image_153.jpg" width="990" height="600" align="left" enableFill="true"/>
        <PreviewFile mediaType="jpg" src="../../media/image_153_thumb.jpg" width="88" height="100"/>
        <Caption/>
    </MediaFile>
    <MediaFile id="108">
        <File mediaType="jpg" src="../../media/image_108.jpg" width="990" height="600" align="left" enableFill="true"/>
        <PreviewFile mediaType="jpg" src="../../media/image_108_thumb.jpg" width="88" height="100"/>
        <Caption/>
    </MediaFile>
    <MediaFile id="2">
        <File mediaType="jpg" src="../../media/cars_02.jpg" width="990" height="600" align="left" enableFill="true"/>
        <PreviewFile mediaType="jpg" src="../../media/cars_02_thumb.jpg" width="88" height="100"/>
        <Caption/>
    </MediaFile>
    <MediaFile id="146">
        <File mediaType="jpg" src="../../media/image_146.jpg" width="990" height="600" align="left" enableFill="false"/>
        <PreviewFile mediaType="jpg" src="../../media/image_146_thumb.jpg" width="88" height="100"/>
        <Caption/>
    </MediaFile>
    <MediaFile id="5">
        <File mediaType="jpg" src="../../media/cars_05.jpg" width="990" height="600" align="left" enableFill="false"/>
        <PreviewFile mediaType="jpg" src="../../media/cars_05_thumb.jpg" width="88" height="100"/>
        <Caption/>
    </MediaFile>
    <MediaFile id="150">
        <File mediaType="jpg" src="../../media/image_150.jpg" width="990" height="600" align="left" enableFill="true"/>
        <PreviewFile mediaType="jpg" src="../../media/image_150_thumb.jpg" width="88" height="100"/>
        <Caption/>
    </MediaFile>
    <MediaFile id="122">
        <File mediaType="jpg" src="../../media/image_122.jpg" width="990" height="600" align="left" enableFill="true"/>
        <PreviewFile mediaType="jpg" src="../../media/image_122_thumb.jpg" width="88" height="100"/>
        <Caption/>
    </MediaFile>
    <MediaFile id="121">
        <File mediaType="jpg" src="../../media/image_121.jpg" width="990" height="600" align="left" enableFill="true"/>
        <PreviewFile mediaType="jpg" src="../../media/image_121_thumb.jpg" width="88" height="100"/>
        <Caption/>
    </MediaFile>
    <MediaFile id="109">
        <File mediaType="jpg" src="../../media/image_109.jpg" width="990" height="600" align="left" enableFill="true"/>
        <PreviewFile mediaType="jpg" src="../../media/image_109_thumb.jpg" width="88" height="100"/>
        <Caption/>
    </MediaFile>
    <MediaFile id="9">
        <File mediaType="jpg" src="../../media/cars_09.jpg" width="990" height="600" align="left" enableFill="false"/>
        <PreviewFile mediaType="jpg" src="../../media/cars_09_thumb.jpg" width="88" height="100"/>
        <Caption/>
    </MediaFile>
    <MediaFile id="10">
        <File mediaType="jpg" src="../../media/cars_10.jpg" width="990" height="600" align="left" enableFill="true"/>
        <PreviewFile mediaType="jpg" src="../../media/cars_10_thumb.jpg" width="88" height="100"/>
        <Caption/>
    </MediaFile>
    <MediaFile id="11">
        <File mediaType="jpg" src="../../media/cars_11.jpg" width="990" height="600" align="left" enableFill="true"/>
        <PreviewFile mediaType="jpg" src="../../media/cars_11_thumb.jpg" width="88" height="100"/>
        <Caption/>
    </MediaFile>
    <MediaFile id="12">
        <File mediaType="jpg" src="../../media/cars_12.jpg" width="990" height="600" align="left" enableFill="true"/>
        <PreviewFile mediaType="jpg" src="../../media/cars_12_thumb.jpg" width="88" height="100"/>
        <Caption/>
    </MediaFile>
    <MediaFile id="13">
        <File mediaType="jpg" src="../../media/cars_13.jpg" width="990" height="600" align="left" enableFill="true"/>
        <PreviewFile mediaType="jpg" src="../../media/cars_13_thumb.jpg" width="88" height="100"/>
        <Caption/>
    </MediaFile>
    <MediaFile id="14">
        <File mediaType="jpg" src="../../media/cars_14.jpg" width="990" height="600" align="left" enableFill="true"/>
        <PreviewFile mediaType="jpg" src="../../media/cars_14_thumb.jpg" width="88" height="100"/>
        <Caption/>
    </MediaFile>
    <MediaFile id="17">
        <File mediaType="jpg" src="../../media/cars_17.jpg" width="990" height="600" align="left" enableFill="false"/>
        <PreviewFile mediaType="jpg" src="../../media/cars_17_thumb.jpg" width="88" height="100"/>
        <Caption/>
    </MediaFile>
    <MediaFile id="156">
        <File mediaType="jpg" src="../../media/image_156.jpg" width="990" height="600" align="left" enableFill="true"/>
        <PreviewFile mediaType="jpg" src="../../media/image_156_thumb.jpg" width="88" height="100"/>
        <Caption/>
    </MediaFile>
    <MediaFile id="157">
        <File mediaType="jpg" src="../../media/image_157.jpg" width="990" height="600" align="left" enableFill="true"/>
        <PreviewFile mediaType="jpg" src="../../media/image_157_thumb.jpg" width="88" height="100"/>
        <Caption/>
    </MediaFile>
    <MediaFile id="18">
        <File mediaType="jpg" src="../../media/cars_18.jpg" width="990" height="600" align="left" enableFill="true"/>
        <PreviewFile mediaType="jpg" src="../../media/cars_18_thumb.jpg" width="88" height="100"/>
        <Caption/>
    </MediaFile>
    <MediaFile id="19">
        <File mediaType="jpg" src="../../media/cars_19.jpg" width="990" height="600" align="left" enableFill="true"/>
        <PreviewFile mediaType="jpg" src="../../media/cars_19_thumb.jpg" width="88" height="100"/>
        <Caption/>
    </MediaFile>
    <MediaFile id="21">
        <File mediaType="jpg" src="../../media/cars_21.jpg" width="990" height="600" align="left" enableFill="true"/>
        <PreviewFile mediaType="jpg" src="../../media/cars_21_thumb.jpg" width="88" height="100"/>
        <Caption/>
    </MediaFile>
    <MediaFile id="25">
        <File mediaType="jpg" src="../../media/cars_25.jpg" width="990" height="600" align="left" enableFill="true"/>
        <PreviewFile mediaType="jpg" src="../../media/cars_25_thumb.jpg" width="88" height="100"/>
        <Caption/>
    </MediaFile>
    <MediaFile id="23">
        <File mediaType="jpg" src="../../media/cars_23.jpg" width="990" height="600" align="left" enableFill="true"/>
        <PreviewFile mediaType="jpg" src="../../media/cars_23_thumb.jpg" width="88" height="100"/>
        <Caption/>
    </MediaFile>
</Gallery>